{
  "kind": "upsert",
  "schemaVersion": 1,
  "view": "archive",
  "complete": true,
  "totalRows": 1,
  "window": {
    "offset": 0,
    "limit": 1,
    "rowCount": 1,
    "nextOffset": null
  },
  "epoch": "fixture-epoch",
  "seq": 8,
  "freshness": {
    "status": "fresh",
    "lastAttemptAt": "2026-05-30T00:00:00.000Z",
    "lastSyncAt": "2026-05-30T00:00:00.000Z",
    "lastError": null
  },
  "identityVersion": 1,
  "projectionEngineVersion": 1,
  "sourceHostID": "Amir-M5",
  "scope": "view",
  "viewParamsKey": "archive:Amir-M5",
  "order": "displayOrderKeyAscending",
  "rows": [
    {
      "schemaVersion": 1,
      "identityVersion": 1,
      "projectionEngineVersion": 1,
      "sourceHostID": "Amir-M5",
      "view": "archive",
      "projectionID": "host:Amir-M5/thread:thread-1/row:threadCard",
      "sourceRef": "host:Amir-M5/thread:thread-1",
      "rowRole": "threadCard",
      "displayOrderKey": "9998219900800000|0002|host%3AAmir-M5%2Fthread%3Athread-1%2Frow%3AthreadCard",
      "id": "host:Amir-M5/thread:thread-1/row:threadCard",
      "logicalHostID": "Amir-M5",
      "threadID": "thread-1",
      "backendSessionID": "session-1",
      "hostDisplayName": "Amir-M5",
      "hostEndpoint": "amir-m5.fairy-salmon.ts.net:4510",
      "activityAt": "2026-05-30T00:00:00.000Z",
      "activityAtMs": 1780099200000,
      "displaySummary": "Archived a card stream row.",
      "title": "Thread card fixture",
      "status": "idle",
      "sourceKind": "human",
      "lane": "human",
      "archiveState": "archived",
      "freshness": "fresh",
      "completeness": "complete",
      "repository": "codex-client",
      "workingDirectory": "/Users/aelaguiz/workspace/codex-client",
      "branch": "codex-dock-agents-tab-live-counts",
      "summarySource": "assistant_label"
    }
  ],
  "projectionIDs": []
}
