{
  "kind": "snapshot",
  "schemaVersion": 1,
  "view": "dock",
  "complete": true,
  "totalRows": 1,
  "window": {
    "offset": 0,
    "limit": 1,
    "rowCount": 1,
    "nextOffset": null
  },
  "epoch": "fixture-epoch",
  "seq": 10,
  "asOf": "2026-05-30T00:02:00.000Z",
  "freshness": {
    "status": "fresh",
    "lastAttemptAt": "2026-05-30T00:02:00.000Z",
    "lastSyncAt": "2026-05-30T00:02:00.000Z",
    "lastError": null
  },
  "identityVersion": 1,
  "projectionEngineVersion": 1,
  "sourceHostID": "Amir-M5",
  "scope": "view",
  "viewParamsKey": "dock:Amir-M5",
  "order": "displayOrderKeyAscending",
  "rows": [
    {
      "schemaVersion": 1,
      "identityVersion": 1,
      "projectionEngineVersion": 1,
      "sourceHostID": "Amir-M5",
      "view": "dock",
      "projectionID": "host:Amir-M5/thread:thread-live-only/row:threadCard",
      "sourceRef": "host:Amir-M5/thread:thread-live-only",
      "rowRole": "threadCard",
      "displayOrderKey": "9998219900680000|0001|host%3AAmir-M5%2Fthread%3Athread-live-only%2Frow%3AthreadCard",
      "id": "host:Amir-M5/thread:thread-live-only/row:threadCard",
      "logicalHostID": "Amir-M5",
      "threadID": "thread-live-only",
      "backendSessionID": "session-live-only",
      "hostDisplayName": "Amir-M5",
      "hostEndpoint": "amir-m5.fairy-salmon.ts.net:4510",
      "activityAt": "2026-05-30T00:02:00.000Z",
      "activityAtMs": 1780099320000,
      "displaySummary": "Live event row folded into relay card truth before emission.",
      "title": "Live only row fixture",
      "status": "running",
      "sourceKind": "human",
      "lane": "human",
      "archiveState": "active",
      "freshness": "fresh",
      "completeness": "complete",
      "repository": "codex-client",
      "workingDirectory": "/Users/aelaguiz/workspace/codex-client",
      "branch": "codex-dock-agents-tab-live-counts",
      "summarySource": "live_event"
    }
  ],
  "projectionIDs": []
}
