{
  "kind": "snapshot",
  "schemaVersion": 1,
  "view": "dock",
  "complete": false,
  "totalRows": 1,
  "window": {
    "offset": 0,
    "limit": 1,
    "rowCount": 1,
    "nextOffset": null
  },
  "epoch": "fixture-epoch",
  "seq": 9,
  "asOf": "2026-05-30T00:01:00.000Z",
  "freshness": {
    "status": "stale",
    "lastAttemptAt": "2026-05-30T00:01:00.000Z",
    "lastSyncAt": null,
    "lastError": "activity proof unavailable"
  },
  "identityVersion": 1,
  "projectionEngineVersion": 1,
  "sourceHostID": "Amir-M5",
  "scope": "view",
  "viewParamsKey": "dock:Amir-M5",
  "order": "displayOrderKeyAscending",
  "rows": [
    {
      "schemaVersion": 1,
      "identityVersion": 1,
      "projectionEngineVersion": 1,
      "sourceHostID": "Amir-M5",
      "view": "dock",
      "projectionID": "host:Amir-M5/thread:thread-unproven/row:threadCard",
      "sourceRef": "host:Amir-M5/thread:thread-unproven",
      "rowRole": "threadCard",
      "displayOrderKey": "9998219900740000|0004|host%3AAmir-M5%2Fthread%3Athread-unproven%2Frow%3AthreadCard",
      "id": "host:Amir-M5/thread:thread-unproven/row:threadCard",
      "logicalHostID": "Amir-M5",
      "threadID": "thread-unproven",
      "backendSessionID": "session-unproven",
      "hostDisplayName": "Amir-M5",
      "hostEndpoint": "amir-m5.fairy-salmon.ts.net:4510",
      "activityAt": "2026-05-30T00:01:00.000Z",
      "activityAtMs": 1780099260000,
      "displaySummary": "Retained only as stale because canonical activity could not be proven.",
      "title": "Unproven activity fixture",
      "status": "unknown",
      "sourceKind": "human",
      "lane": "human",
      "archiveState": "active",
      "freshness": "stale",
      "completeness": "partial",
      "repository": "codex-client",
      "workingDirectory": "/Users/aelaguiz/workspace/codex-client",
      "branch": "codex-dock-agents-tab-live-counts",
      "summarySource": "activity_proof_unavailable"
    }
  ],
  "projectionIDs": []
}
